{
  "protocol_version": "1.0-rc4",
  "type": "network_status",
  "request_id": "550e8400-e29b-41d4-a716-446655440000",
  "device_id": "bbx-82f41c9e7a3d4b68a1501e21e536c649",
  "ok": true,
  "payload": {
    "active_mode": "direct_ap",
    "desired_mode": "direct_ap",
    "operation_state": "ap_ready",
    "operation_id": "op_J7c4M2",
    "busy": false,
    "base_uri": "http://192.168.82.1:8080",
    "direct_ap": {"ssid": "BirdBox-82F41C9E", "security": "wpa2_personal", "gateway_ipv4": "192.168.82.1", "prefix_length": 24, "client_count": 1},
    "infrastructure_sta": {"ssid": null, "bssid": null, "ipv4": null, "prefix_length": null, "gateway_ipv4": null, "network_kind": null, "provisioning_method": null, "saved": true},
    "last_error": null,
    "updated_at": "2026-08-18T10:00:00+08:00"
  }
}
